{
  "$schema": "https://raw.githubusercontent.com/GxFn/Wakeflow/main/core/schemas/wakeflow-config.schema.json",
  "schemaVersion": 2,
  "workspace": {
    "name": "Wakeflow",
    "language": "auto",
    "runtimeMode": "repository",
    "root": "..",
    "wakeflowRepoDir": "Wakeflow"
  },
  "roles": {
    "controller": "Wakeflow",
    "design": "Design",
    "test": "Test"
  },
  "storage": {
    "activeRoot": ".wakeflow-active",
    "localRoot": ".wakeflow-local",
    "ledgerRoot": "../wakeflow-ledger"
  },
  "policy": {
    "allowMissingRepos": true,
    "runtimeProcessMatchers": [],
    "runtimeProcessLabel": "configured"
  },
  "repositories": [
    {
      "windowName": "Design",
      "path": "../Design",
      "role": "Internal requirement and outcome design workspace",
      "managedAgents": false,
      "mode": "internal"
    },
    {
      "windowName": "Test",
      "path": "../Test",
      "role": "Internal test coordination workspace",
      "managedAgents": false,
      "mode": "internal"
    }
  ],
  "hosts": {
    "claude-code": {},
    "codex": {}
  }
}
